{"schema_id":"jft.nse_cm.manifest","schema_major":1,"source":{"logical_path":"CM_Orders_T_18052026_01.DAT.gz","prefix":"cm","product":"trim","record_kind":"orders","source_date":"2026-05-18","stream":1,"layout_id":"nse_cm_trim_v1_19_order_68"},"compressed":{"byte_count":16,"md5":"50eed83f4eefca1fa9cf1db743255e6f","sha256":"162d9991fca84f270f6bb22f8d75ae1abc8f3846e768868629d44206ae649248"},"trigger":{"status":"verified","declared_byte_count":16,"declared_md5":"50eed83f4eefca1fa9cf1db743255e6f"},"payload":{"byte_count":69,"sha256":"85a1f60822ac5f4b6b328576faccec15d2527fbb776a9949c07c1b29087a9197","payload_width":68,"delimiter":"lf","framed_records":1,"parsed_records":1,"quarantined_records":0,"residue_bytes":0,"raw_jiffy_minimum":91200611817221,"raw_jiffy_maximum":91200611817221},"processing":{"configuration_id":"fixture-config-v1","code_identity":"test-code"}}
